{
  "version": 2,
  "generatedAt": "2026-08-11T05:05:00.000Z",
  "currency": "USD",
  "spendPolicy": {
    "dailyLimitUsd": 100,
    "source": "config/toolsenabled.policy.json limits.defaultDailySpendUsd, read as dailyLimitCents by src/lib/providers/pay.js",
    "readAt": "2026-08-11T04:32:00.000Z"
  },
  "categories": [
    {
      "id": "required-to-ship",
      "label": "Needed to ship",
      "blurb": "Without these the product cannot honestly go out the door. Three lines, and one of them is a server backup you already ordered switched on once."
    },
    {
      "id": "required-before-charging",
      "label": "Needed before you take money",
      "blurb": "You can ship without all of these. Note what is no longer here: forming a company. Stripe takes payments from a sole proprietor, so the company is off this list and moved down to defensive."
    },
    {
      "id": "optional-defensive",
      "label": "Defensive, not urgent",
      "blurb": "Real options with real reasons, none holding up a release. The company formation lives here, with all four state options priced, because nothing about shipping or charging actually requires it."
    },
    {
      "id": "do-not-buy",
      "label": "Do not buy yet",
      "blurb": "You asked for all options. An option ruled out with a reason is information, not padding. Every line is something a reasonable person would consider and should not buy today."
    }
  ],
  "items": [
    {
      "id": "azure-artifact-signing",
      "name": "Code signing certificate",
      "vendor": "Microsoft Azure Artifact Signing, Basic tier",
      "category": "required-to-ship",
      "cadence": "monthly",
      "firstYearUsd": 9.99,
      "renewalUsd": null,
      "priceVerified": true,
      "priceVerifiedDate": "2026-08-11",
      "quantityMax": 1,
      "defaultSelected": true,
      "whatItIs": "A signing service that puts a verified publisher name on the installer, so Windows stops telling people the download comes from an unknown publisher.",
      "whatBreaksWithout": "Everyone who downloads the installer gets the full-screen blue panel with NO publisher name, and must find and click More info then Run anyway. Under workplace policy that bypass can be switched off entirely, making the installer unrunnable. The Guided installer tier built for non-technical users does not ship without this.",
      "whyHeWantedIt": "You asked the price directly, R1203: okay how much is the certificate but also it is for ai friendly so if they are super pessimistic it wont work anyway, some amount of click through needs to happen. Your question became a tracked gate, and your adopted monetization ruling also names a code-signing certificate among the things that must exist before any payment is taken.",
      "sourceUrl": "https://azure.microsoft.com/en-us/products/artifact-signing",
      "warning": "The ORDER matters, and it is the opposite of what you were told. Microsoft states that a billing account of type Individual can only validate an individual identity and cannot validate an organization identity, or the reverse. Forming a company first pushes you onto the organization path, which needs business documents you will not have. Do the individual identity check FIRST, incorporate later if you want to.",
      "blockers": [],
      "notes": "Price verified four ways today including Microsoft's own retail price feed. Two costs the pricing page hides: it does not work on a free, trial or sponsored Azure subscription, so you need pay-as-you-go with a card on file; and billing is not pro-rated, so the full $9.99 is charged for whatever month you start in. Honest expectation: this does NOT remove the warning on day one. Microsoft's own docs say reputation builds only over several weeks and hundreds of clean installs, and that there is no mechanism to buy past it at any price. One earlier claim retired, recorded here so nobody re-adds it: an internal note in this project says Microsoft's organization path requires three years of verifiable business history. That was said by a Microsoft employee on a support forum in 2025 and appears nowhere in current Microsoft documentation, so it is not relied on. The practical instruction is unchanged and now rests on a rule Microsoft does still publish - the billing-account rule in the warning above."
    },
    {
      "id": "droplet-backups-weekly",
      "name": "Backups on the live server",
      "vendor": "DigitalOcean",
      "category": "required-to-ship",
      "cadence": "monthly",
      "firstYearUsd": 4.8,
      "renewalUsd": null,
      "priceVerified": true,
      "priceVerifiedDate": "2026-08-11",
      "quantityMax": 1,
      "defaultSelected": true,
      "whatItIs": "Automatic weekly whole-machine images of the server that already runs your site, so it can be restored if it is lost, corrupted or broken into.",
      "whatBreaksWithout": "This is not hypothetical. I read your DigitalOcean account today and backups are OFF: zero backup images, zero snapshots, on a server that has been running since June 2025. If it is lost tomorrow there is nothing at all to restore from.",
      "whyHeWantedIt": "This is your own standing directive and it was never carried out. R1162, 2026-08-08: Droplet backups: default ON. Managed backups should be the default behavior on the production-serving droplet, not an opt-in. Three days later it is still opt-in and still off.",
      "sourceUrl": "https://docs.digitalocean.com/products/backups/details/pricing/",
      "warning": null,
      "blockers": [],
      "notes": "Priced from your actual server rather than a guess: it is a 4 GiB, 2 vCPU, 80 GiB instance at $24.00 a month, and weekly backups cost 20 percent of the server's monthly cost. That is $4.80 a month, $57.60 a year. The server itself is already running and already paid for, so it is not a purchase and is deliberately not on this list."
    },
    {
      "id": "primary-domain",
      "name": "Primary domain name",
      "vendor": "Porkbun",
      "category": "required-to-ship",
      "cadence": "annual",
      "firstYearUsd": 11.08,
      "renewalUsd": null,
      "priceVerified": true,
      "priceVerifiedDate": "2026-08-11",
      "quantityMax": 3,
      "defaultSelected": false,
      "whatItIs": "The web address the product lives at, and the domain every support and billing email is sent from.",
      "whatBreaksWithout": "Your ruling requires published terms and a privacy policy before the first dollar, and a policy sitting in a code repository is not published. Stripe's signup asks for a business website. The strict minimum really is $0 - a free hosted page would technically carry both - so this is not impossible to ship without. What $11 buys is an address you own that does not put someone else's brand in the URL a customer reads before trusting you with their machine.",
      "whyHeWantedIt": "You asked for it twice. R1162, 2026-08-07: ok do we need a digital ocean server for this then? because there needs to be a website. we also need a good url. you have my credit info in the vault, it sends me an approval, ill approve reasonable purchases. And again on 2026-08-08: we need a url then right? have any luna max subagents surface any or can you assign 2 personally? You also said plainly: Yes we need a hompage and a privacy policy.",
      "sourceUrl": "https://porkbun.com/tld/com",
      "warning": "There is a real deadline on this one and it has nothing to do with us. The wholesale .com price rises from $10.26 to $10.97 on 2026-11-01 - the registry gave formal notice on an earnings call - and every registrar passes it straight through. That is about twelve weeks away. Registering or renewing multiple years BEFORE that date locks today's rate; after it, every year costs about seventy cents more, forever.",
      "blockers": [
        {
          "code": "NAME_NOT_DECIDED",
          "summary": "The company and product name is not settled, and a trademark and name-availability check is running right now. Buying before it clears risks paying for the wrong name and buying again.",
          "severity": "blocking"
        }
      ],
      "notes": "No first-year-versus-renewal gap here: $11.08 every year at this registrar, which is unusual and is exactly why it beats cheaper-looking alternatives. Quantity up to 3 in case you want the exact name plus a spelling or two. Availability was established by direct registry record lookups rather than by typing candidate names into a registrar search box, because search boxes are the actual front-running leak vector and you were right to worry about that."
    },
    {
      "id": "stripe-account",
      "name": "Payment processing account",
      "vendor": "Stripe",
      "category": "required-before-charging",
      "cadence": "one-off",
      "firstYearUsd": 0,
      "renewalUsd": null,
      "priceVerified": true,
      "priceVerifiedDate": "2026-08-10",
      "quantityMax": 1,
      "defaultSelected": false,
      "whatItIs": "The service that takes a customer's card and puts the money in your bank. There is nothing to buy - it takes a share of money you have already been paid.",
      "whatBreaksWithout": "There is no way to charge anyone anything. Worth knowing that nothing in the product currently refuses to run unlicensed either, so this is one half of a two-part problem and the other half is engineering rather than a purchase.",
      "whyHeWantedIt": "You asked directly: we have stripe for payment or whatever was decided? no need for anything else? The answer is that Stripe costs $0 up front and is already the right choice - the integration in this codebase already points at Stripe's real production API, with products, prices, checkout, the billing portal and webhook verification all built.",
      "sourceUrl": "https://stripe.com/pricing",